<?xml version="1.0"?>
<!DOCTYPE entities SYSTEM "entities.dtd">
<listentities>
<entity id="3" label="ground" mdref="carre_texture.pno" envtype="ground" objtype="object" class="PN3DObject" x="-25.0631" y="-101.614" z="-6.23442" xx="0" yy="0" zz="0" ww="1">
</entity>
<entity id="2" label="cube" mdref="carre_texture.pno" envtype="static" objtype="object" class="PN3DObject" x="62.9448" y="14.0349" z="-40.3354" xx="0" yy="0" zz="0" ww="1">
</entity>
<entity id="4" label="SkyBoite" mdref="skybox_poor.pno" envtype="static" objtype="object" class="PN3DObject" x="56.65" y="-245.789" z="-34.3423" xx="0" yy="0" zz="0" ww="1">
</entity>
<entity id="1" label="Mecton" mdref="Mecton.pno" envtype="dynamic" objtype="character" class="PN3DSkeletonObject" x="32.8376" y="-151.968" z="-161.339" xx="0" yy="0" zz="0" ww="1">
<action ref="PN_EVENT_GAME_PAUSE">
<script ref="script_9.lua"/>
</action>
<action ref="PN_EVENT_COLLISION">
<script ref="script_1.lua"/>
<script ref="script_2.lua"/>
</action>
</entity>
<entity id="4" label="Fred" mdref="3ddynobject.pno" envtype="dynamic" objtype="dynamic" class="PN3DSkeletonObject" x="-2.85464" y="10.8192" z="-6.7865" xx="0" yy="0" zz="0" ww="1">
</entity>
</listentities>
